{
  "$schema": "http://json-schema.org/draft-07/schema#",
  "$id": "https://github.com/OWNER/orientation-engine/schema/filiere.schema.json",
  "title": "Filière",
  "description": "Fiche canonique d'une filière. Toute donnée du moteur d'orientation passe par ce schéma.",
  "type": "object",
  "required": [
    "id",
    "nom",
    "ecole",
    "niveau",
    "axes",
    "domaines",
    "meta"
  ],
  "additionalProperties": false,
  "properties": {
    "id": {
      "type": "string",
      "pattern": "^[a-z0-9]+(-[a-z0-9]+)*$",
      "description": "Identifiant stable en kebab-case. Ne jamais le changer une fois publié."
    },
    "nom": {
      "type": "string",
      "minLength": 3
    },
    "ecole": {
      "type": [
        "string",
        "null"
      ],
      "description": "Doit exister dans config/taxonomy.json > ecoles. null tant que la fiche est en brouillon."
    },
    "niveau": {
      "type": "string",
      "enum": [
        "bts",
        "licence",
        "bachelor",
        "licence-pro",
        "master",
        "mba",
        "dba",
        "certificat"
      ],
      "description": "Ce que le programme DELIVRE."
    },
    "duree_annees": {
      "type": "number",
      "minimum": 0.5,
      "maximum": 6
    },
    "langue": {
      "type": "string",
      "enum": [
        "francais",
        "anglais",
        "bilingue"
      ],
      "default": "francais"
    },
    "eligibilite": {
      "type": "object",
      "description": "FILTRES DURS. Exclut des filières, ne les note jamais.",
      "additionalProperties": false,
      "properties": {
        "series_bac": {
          "type": "array",
          "items": {
            "type": "string"
          },
          "description": "Vide = toutes séries acceptées. Sinon, liste issue de taxonomy > series_bac."
        },
        "niveau_maths": {
          "type": "string",
          "enum": [
            "aucun",
            "faible",
            "moyen",
            "eleve"
          ],
          "description": "Niveau de maths réellement exigé pour réussir, pas celui affiché."
        },
        "prerequis_autres": {
          "type": "array",
          "items": {
            "type": "string"
          }
        }
      }
    },
    "axes": {
      "type": "object",
      "description": "Les 5 axes de contenu sont COMPTES depuis unites_enseignement, pas notes a la main. Les 2 axes de disposition (ancrage, abstraction) ne vivent PAS ici : ils sont au niveau de la FAMILLE, dans config/familles_axes.json.",
      "required": [
        "quantitatif",
        "technique",
        "relationnel",
        "creatif",
        "cadre"
      ],
      "additionalProperties": false,
      "properties": {
        "quantitatif": {
          "type": "integer",
          "minimum": 1,
          "maximum": 5
        },
        "technique": {
          "type": "integer",
          "minimum": 1,
          "maximum": 5
        },
        "relationnel": {
          "type": "integer",
          "minimum": 1,
          "maximum": 5
        },
        "creatif": {
          "type": "integer",
          "minimum": 1,
          "maximum": 5
        },
        "cadre": {
          "type": "integer",
          "minimum": 1,
          "maximum": 5
        }
      }
    },
    "axes_parts": {
      "type": "object",
      "additionalProperties": false,
      "description": "La MEME mesure que `axes`, non arrondie : part des modules du programme que le lexique de chaque axe capte. C'est cette version que le moteur utilise pour la CORRELATION DE FORME ; `axes` ne sert qu'a l'affichage et aux tests d'ancrage. L'arrondi de noter() ecrase 10 points de proportion dans un entier et fabrique des egalites exactes a r = 1,00 entre programmes de formes differentes. La somme peut depasser 1 : un module compte pour tous les axes qui le captent.",
      "required": [
        "quantitatif",
        "technique",
        "relationnel",
        "creatif",
        "cadre"
      ],
      "properties": {
        "quantitatif": { "type": "number", "minimum": 0, "maximum": 1 },
        "technique": { "type": "number", "minimum": 0, "maximum": 1 },
        "relationnel": { "type": "number", "minimum": 0, "maximum": 1 },
        "creatif": { "type": "number", "minimum": 0, "maximum": 1 },
        "cadre": { "type": "number", "minimum": 0, "maximum": 1 }
      }
    },
    "axes_fiables": {
      "type": "boolean",
      "description": "CALCULE par scripts/distinctivite.mjs. Faux quand trop de modules du programme ne sont reconnus par aucun lexique : ses 5 axes ne decrivent alors pas son contenu. Le moteur NE DOIT PAS classer ces programmes par le score — voir CLAUDE.md > Programmes aux axes non fiables. Absent = non evalue (la distinctivite n'a pas tourne), a traiter comme non fiable.",
      "default": true
    },
    "domaines": {
      "type": "array",
      "minItems": 1,
      "items": {
        "type": "string"
      },
      "description": "Liste FERMÉE, voir config/taxonomy.json > domaines. Sert à l'aiguillage."
    },
    "profil_ideal": {
      "type": "array",
      "items": {
        "type": "string"
      },
      "maxItems": 4,
      "description": "3 traits maximum. Pas de paragraphe."
    },
    "deconseille_si": {
      "type": "array",
      "items": {
        "type": "string"
      },
      "description": "Signaux d'alerte. Génèrent les poids négatifs. Jamais présent dans une brochure."
    },
    "voisines": {
      "type": "array",
      "description": "ids des filieres confondues avec celle-ci. La question de departage vit dans config/departages.json, indexee par paire.",
      "items": {
        "type": "string"
      }
    },
    "debouches": {
      "type": "object",
      "additionalProperties": false,
      "properties": {
        "metiers": {
          "type": "array",
          "items": {
            "type": "string"
          }
        },
        "secteurs": {
          "type": "array",
          "items": {
            "type": "string"
          }
        },
        "poursuite_etudes": {
          "type": "array",
          "items": {
            "type": "string"
          }
        }
      }
    },
    "vitrine": {
      "type": "object",
      "description": "Ce qui s'affiche sur l'écran de résultat.",
      "additionalProperties": false,
      "properties": {
        "accroche": {
          "type": "string",
          "maxLength": 120
        },
        "description": {
          "type": "string"
        },
        "fait_marquant": {
          "type": "string"
        },
        "couleur": {
          "type": "string",
          "pattern": "^#[0-9a-fA-F]{6}$"
        }
      }
    },
    "meta": {
      "type": "object",
      "description": "Traçabilité. Indique quels champs sont fiables et lesquels attendent validation.",
      "required": [
        "sources",
        "statut"
      ],
      "additionalProperties": false,
      "properties": {
        "sources": {
          "type": "object",
          "description": "Pour chaque champ renseigné : d'où vient la donnée.",
          "additionalProperties": {
            "type": "string",
            "enum": [
              "brochure",
              "inference",
              "responsable",
              "admissions",
              "manuel"
            ]
          }
        },
        "statut": {
          "type": "string",
          "enum": [
            "brouillon",
            "a_valider",
            "valide"
          ],
          "description": "brouillon = extrait automatiquement. valide = confirmé par le responsable."
        },
        "brochure_fichier": {
          "type": "string"
        },
        "annee_source": {
          "type": "integer"
        },
        "valide_par": {
          "type": "string"
        },
        "valide_le": {
          "type": "string",
          "format": "date"
        }
      }
    },
    "modalites": {
      "type": "array",
      "items": {
        "type": "string",
        "enum": [
          "presentiel",
          "en-ligne",
          "cours-du-soir",
          "week-end",
          "full-time"
        ]
      },
      "description": "FILTRE. Present dans les brochures."
    },
    "parcours": {
      "type": [
        "string",
        "null"
      ],
      "description": "Regroupement thematique affiche en bandeau dans le catalogue."
    },
    "departement": {
      "type": [
        "string",
        "null"
      ],
      "description": "Sous-ensemble d'une ecole (ex. Sciences et Technologies appliquees)."
    },
    "option": {
      "type": [
        "string",
        "null"
      ],
      "description": "Option d'un programme parent (ex. Licence en Gestion option Agrobusiness)."
    },
    "programme_parent": {
      "type": [
        "string",
        "null"
      ],
      "description": "id de la fiche parente si cette fiche est une option."
    },
    "partenariats": {
      "type": "object",
      "additionalProperties": false,
      "properties": {
        "double_diplome": {
          "type": [
            "string",
            "null"
          ]
        },
        "diplome_delocalise": {
          "type": [
            "string",
            "null"
          ]
        },
        "accreditations": {
          "type": "array",
          "items": {
            "type": "string"
          }
        }
      }
    },
    "exigence_quantitative": {
      "type": "object",
      "additionalProperties": false,
      "description": "AVERTISSEMENT informatif, derive du comptage des modules dans les UE. N'exclut jamais, ne score jamais.",
      "properties": {
        "modules_comptes": {
          "type": "integer",
          "minimum": 0
        },
        "modules_exemples": {
          "type": "array",
          "items": {
            "type": "string"
          },
          "maxItems": 5
        },
        "niveau": {
          "type": "string",
          "enum": [
            "faible",
            "modere",
            "eleve"
          ]
        }
      }
    },
    "unites_enseignement": {
      "type": "array",
      "items": {
        "type": "object",
        "additionalProperties": false,
        "required": [
          "intitule"
        ],
        "properties": {
          "intitule": {
            "type": "string"
          },
          "modules": {
            "type": "array",
            "items": {
              "type": "string"
            }
          }
        }
      },
      "description": "Listes d'UE extraites de la brochure. Base de l'inference des axes et du comptage quantitatif."
    },
    "niveau_acces": {
      "type": [
        "string",
        "null"
      ],
      "enum": [
        "bac",
        "bac+2",
        "bac+3",
        "bac+4",
        "bac+5",
        null
      ],
      "description": "Diplome EXIGE a l'entree. Distinct de niveau. Present dans les brochures (« accessible apres un bac+2 », « BAC+3 »). FILTRE dur."
    },
    "structure_ue": {
      "type": "object",
      "additionalProperties": false,
      "description": "CALCULE par scripts/distinctivite.mjs. Ce que la STRUCTURE en unites d'enseignement dit du programme, la ou le comptage des axes traite les modules comme un sac de mots. Voir CLAUDE.md > La structure en UE porte des distinctions que les axes ne voient pas.",
      "properties": {
        "publiee": {
          "type": "boolean",
          "description": "Le catalogue publie-t-il un decoupage en UE pour ce programme ? Faux pour les 54 fiches du catalogue Master, qui n'alignent qu'une liste plate de modules : concentration et blocs_types n'y veulent rien dire."
        },
        "nb_ue": {
          "type": "integer",
          "minimum": 0
        },
        "nb_modules": {
          "type": "integer",
          "minimum": 0
        },
        "concentration": {
          "type": [
            "number",
            "null"
          ],
          "minimum": 0,
          "maximum": 1,
          "description": "Part des modules portee par la plus grosse UE. Proche de 1 = specialise, proche de 1/nb_ue = generaliste. MESURE BRUTE, sans seuil : aucun libelle n'en est derive tant qu'un test n'a pas montre ce qu'il apporte. null si le decoupage n'est pas publie."
        },
        "blocs_types": {
          "type": "array",
          "items": {
            "type": "string"
          },
          "description": "UE recurrentes du catalogue que ce programme porte, detectees par similarite d'intitule — pas une liste ecrite a la main. Le bloc management-organisations est la signature d'un programme tourne vers l'entreprise plutot que vers l'approfondissement technique."
        }
      }
    },
    "distinctivite": {
      "type": "object",
      "additionalProperties": false,
      "description": "CALCULE par scripts/distinctivite.mjs. Ce qui distingue ce programme des autres de son domaine. Alimente les questions de fin de parcours et la justification du resultat. DEUX mesures : le recouvrement de modules dit ce que le catalogue partage, la correlation d'axes dit qui produira un ex aequo au scoring. Elles ne coincident pas.",
      "properties": {
        "modules_exclusifs": {
          "type": "array",
          "items": {
            "type": "string"
          }
        },
        "metiers_exclusifs": {
          "type": "array",
          "items": {
            "type": "string"
          }
        },
        "recouvrement_max": {
          "type": "number",
          "minimum": 0,
          "maximum": 1
        },
        "plus_proche": {
          "type": [
            "string",
            "null"
          ]
        },
        "correlation_axes_max": {
          "type": "number",
          "minimum": -1,
          "maximum": 1,
          "description": "Correlation de forme la plus elevee avec un programme du meme domaine, calculee comme le score du moteur. C'est CETTE mesure qui predit l'ex aequo, pas le recouvrement de modules."
        },
        "plus_proche_axes": {
          "type": [
            "string",
            "null"
          ],
          "description": "Programme du meme domaine dont la forme d'axes est la plus proche. Souvent different de plus_proche."
        }
      }
    }
  }
}