{
  "id": "master-audit-controle-de-gestion-et-aide-a-la-decision-en-ligne",
  "nom": "Master Audit Contrôle de Gestion et aide à la Décision",
  "ecole": "ism-online",
  "niveau": "master",
  "langue": "francais",
  "eligibilite": {
    "series_bac": [],
    "prerequis_autres": []
  },
  "niveau_acces": "bac+3",
  "modalites": [
    "en-ligne"
  ],
  "axes": {
    "quantitatif": 5,
    "technique": 2,
    "relationnel": 3,
    "creatif": 1,
    "cadre": 5
  },
  "axes_parts": {
    "quantitatif": 0.5833,
    "technique": 0.125,
    "relationnel": 0.25,
    "creatif": 0,
    "cadre": 0.625
  },
  "domaines": [
    "comptabilite",
    "gestion"
  ],
  "profil_ideal": [],
  "deconseille_si": [],
  "debouches": {
    "metiers": [
      "Auditeur Interne",
      "Contrôleur de gestion Trésorier",
      "Contrôleur budgétaire Risk manager",
      "Consultant",
      "Auditeur financier"
    ],
    "secteurs": [],
    "poursuite_etudes": []
  },
  "unites_enseignement": [
    {
      "intitule": "Enseignements M1",
      "modules": [
        "Management Stratégique et RSE",
        "Comptabilité de Gestion",
        "Techniques comptables approfondies",
        "Diagnostic Financier - Etats financiers",
        "Investissement et financement",
        "Normes internationales IFRS",
        "Planification et gestion budgétaire",
        "Comptabilité des groupes",
        "Audit - Contrôle Interne - Contrôle de Gestion",
        "Fiscalité des entreprises",
        "Droit Spécial des Sociétés",
        "Outils de communication et technologies de l’information Enseignements M2",
        "Management Stratégique et Éthique dans les affaires",
        "Normes internationales IFRS",
        "Contrôle de gestion stratégique et pilotage de la performance",
        "Audit comptable et Financier",
        "Audit Fiscal et Social",
        "Audit des Approvisionnements et de la trésorerie",
        "Audit Bancaire et des assurances",
        "Audit de projets et programmes",
        "Contrôle Interne et management des risques",
        "Tableau de bord et Reporting sur Excel",
        "Contrôle de gestion sociale",
        "Méthodologie et Techniques de Recherche et Thèse professionnelle"
      ]
    }
  ],
  "exigence_quantitative": {
    "modules_comptes": 0,
    "modules_exemples": [],
    "niveau": "faible"
  },
  "vitrine": {
    "description": "Acquérir une formation pour répondre aux attentes des entreprises en matière d’audit, de contrôle de gestion et d’aide à la décision est l’objectif principal de ce Master. Il s’agit de doter les étudiants d’un niveau d’expertise et de capacités analytiques leur permettant d’évaluer une organisation, ses procédures et opérations administrativ es et financières."
  },
  "meta": {
    "sources": {
      "nom": "brochure",
      "ecole": "brochure",
      "niveau": "brochure",
      "niveau_acces": "brochure",
      "modalites": "brochure",
      "debouches.metiers": "brochure",
      "unites_enseignement": "brochure",
      "axes": "inference",
      "axes_parts": "inference",
      "domaines": "inference",
      "exigence_quantitative": "inference",
      "vitrine.description": "brochure",
      "distinctivite": "inference",
      "structure_ue": "inference",
      "axes_fiables": "inference",
      "voisines": "inference"
    },
    "statut": "brouillon",
    "brochure_fichier": "ISM_ONLINE_ISF_BROCHURE.pdf"
  },
  "voisines": [
    "licence-de-gestion-option-comptabilite-finance",
    "mba-en-audit-controle-de-gestion-et-aide-a-la-decision"
  ],
  "distinctivite": {
    "modules_exclusifs": [
      "Management Stratégique et RSE",
      "Techniques comptables approfondies",
      "Diagnostic Financier - Etats financiers",
      "Normes internationales IFRS",
      "Planification et gestion budgétaire",
      "Comptabilité des groupes",
      "Audit - Contrôle Interne - Contrôle de Gestion",
      "Droit Spécial des Sociétés"
    ],
    "metiers_exclusifs": [
      "Contrôleur de gestion Trésorier",
      "Contrôleur budgétaire Risk manager"
    ],
    "recouvrement_max": 0.296,
    "plus_proche": "mba-en-audit-controle-de-gestion-et-aide-a-la-decision",
    "correlation_axes_max": 0.957,
    "plus_proche_axes": "mba-en-audit-controle-de-gestion-et-aide-a-la-decision"
  },
  "structure_ue": {
    "publiee": false,
    "nb_ue": 0,
    "nb_modules": 24,
    "concentration": null,
    "blocs_types": []
  },
  "axes_fiables": true
}
