{
  "id": "master-en-fiscalite-droit-des-affaires-option-droit-des-affa",
  "nom": "Master en Fiscalité-Droit des Affaires, Option Droit des Affaires",
  "ecole": "ism-droit",
  "niveau": "master",
  "langue": "francais",
  "eligibilite": {
    "series_bac": [],
    "prerequis_autres": []
  },
  "niveau_acces": "bac+3",
  "modalites": [
    "presentiel"
  ],
  "axes": {
    "quantitatif": 3,
    "technique": 1,
    "relationnel": 5,
    "creatif": 1,
    "cadre": 4
  },
  "axes_parts": {
    "quantitatif": 0.2308,
    "technique": 0,
    "relationnel": 0.4615,
    "creatif": 0,
    "cadre": 0.3846
  },
  "domaines": [
    "droit",
    "fiscalite"
  ],
  "profil_ideal": [],
  "deconseille_si": [],
  "debouches": {
    "metiers": [
      "Juristes d’entreprises publiques ou privées (secteurs du commerce, de l’assurance, de l’immobilier, de l’industrie…)",
      "Juristes de banque",
      "Juristes en cabinets d’avocats",
      "Préparation au concours du barreau et à la magistrature…"
    ],
    "secteurs": [],
    "poursuite_etudes": []
  },
  "unites_enseignement": [
    {
      "intitule": "Contenus pédagogiques",
      "modules": [
        "Ingénierie Juridique des Affaires",
        "Initiation au Management public",
        "Techniques quantitatives de Gestion",
        "Management opérationnel",
        "Instruments de paiement et de Garantie",
        "Fiscalité",
        "Comportement professionnel et renforcement de Capacité",
        "Pratique du Droit des Affaires",
        "Techniques quantitatives de Gestion en Management",
        "Ingénierie Juridique des Affaires",
        "Droit de la propriété",
        "Management",
        "Recherche"
      ]
    }
  ],
  "exigence_quantitative": {
    "modules_comptes": 2,
    "modules_exemples": [
      "Techniques quantitatives de Gestion",
      "Techniques quantitatives de Gestion en Management"
    ],
    "niveau": "modere"
  },
  "vitrine": {
    "description": "Le MBA Droit des Affaires a pour ambition de former des juristes ayant une profonde connaissance de la pratique des affaires et de l’ingénierie juridique dans leurs différentes composantes. En plus de prôner le sens de l’éthique dans les affaires chez nos auditeurs, leur professionnalisation est un point focal de la formation dispensée grâce à des enseignements axés sur la maîtrise du raisonnement juridique, la capacité d’analyse, de rigueur et de synthèse en vue de susciter en eux plus de réactivité et de créativitéen entreprise ou en cabinet."
  },
  "meta": {
    "sources": {
      "nom": "brochure",
      "ecole": "brochure",
      "niveau": "brochure",
      "niveau_acces": "inference",
      "modalites": "brochure",
      "debouches.metiers": "brochure",
      "unites_enseignement": "brochure",
      "axes": "inference",
      "axes_parts": "inference",
      "domaines": "inference",
      "exigence_quantitative": "inference",
      "vitrine.description": "brochure",
      "distinctivite": "inference",
      "structure_ue": "inference",
      "axes_fiables": "inference",
      "voisines": "inference"
    },
    "statut": "brouillon",
    "brochure_fichier": "Brochure Master - MAJ2 2024 - Groupe ISM.pdf",
    "annee_source": 2024
  },
  "option": "Droit des Affaires",
  "voisines": [
    "master-en-droit-notarial-et-gestion-du-patrimoine",
    "master-en-fiscalite-droit-des-affaires-option-affaires-inter",
    "master-en-fiscalite-droit-des-affaires-option-fiscalite",
    "mba-en-droit-et-gouvernance-des-energies-et-des-mines"
  ],
  "distinctivite": {
    "modules_exclusifs": [],
    "metiers_exclusifs": [],
    "recouvrement_max": 0.917,
    "plus_proche": "master-en-fiscalite-droit-des-affaires-option-fiscalite",
    "correlation_axes_max": 0.996,
    "plus_proche_axes": "mba-en-droit-et-gouvernance-des-energies-et-des-mines"
  },
  "structure_ue": {
    "publiee": false,
    "nb_ue": 0,
    "nb_modules": 13,
    "concentration": null,
    "blocs_types": []
  },
  "axes_fiables": true
}
